<?xml version="1.0" encoding="UTF-8"?>
<template xmlns:xsi="http://www.w3.org/2001/XMLSchema-instance" xsi:noNamespaceSchemaLocation="file:///Volumes/Frederick%20Harris%20II/FOX%20Data%20Manager/config/dataset_template.xsd">
    <rootFolder>
        <path>/Volumes/Frederick Harris II/Dissertation Data/caltech-256</path>
        <name>caltech-256</name>
    </rootFolder>
    <folders>
        <folder>
            <paths>
                <path>/Volumes/Frederick Harris II/Dissertation Data/caltech-256/010.beer-mug</path>
                <path>/Volumes/Frederick Harris II/Dissertation Data/caltech-256/026.cake</path>
                <path>/Volumes/Frederick Harris II/Dissertation Data/caltech-256/035.cereal-box</path>
                <path>/Volumes/Frederick Harris II/Dissertation Data/caltech-256/052.crab-101</path>
                <path>/Volumes/Frederick Harris II/Dissertation Data/caltech-256/078.fried-egg</path>
                <path>/Volumes/Frederick Harris II/Dissertation Data/caltech-256/092.grapes</path>
                <path>/Volumes/Frederick Harris II/Dissertation Data/caltech-256/095.hamburger</path>
                <path>/Volumes/Frederick Harris II/Dissertation Data/caltech-256/108.hot-dog</path>
                <path>/Volumes/Frederick Harris II/Dissertation Data/caltech-256/115.ice-cream-cone</path>
                <path>/Volumes/Frederick Harris II/Dissertation Data/caltech-256/150.octopus</path>
                <path>/Volumes/Frederick Harris II/Dissertation Data/caltech-256/160.pez-dispenser</path>
                <path>/Volumes/Frederick Harris II/Dissertation Data/caltech-256/195.soda-can</path>
                <path>/Volumes/Frederick Harris II/Dissertation Data/caltech-256/196.spaghetti</path>
                <path>/Volumes/Frederick Harris II/Dissertation Data/caltech-256/206.sushi</path>
                <path>/Volumes/Frederick Harris II/Dissertation Data/caltech-256/221.tomato</path>
                <path>/Volumes/Frederick Harris II/Dissertation Data/caltech-256/242.watermelon</path>
            </paths>
            <ignores>
                <ignore>ALL</ignore>
            </ignores>
            <actions>
                <action>CREATE_FOOD_ITEM_FROM_IMAGE</action>
                <action>EXTRACT_FOLDER_NAME_AS_FOOD_CATEGORY_CUSTOM_1</action>
            </actions>
        </folder>
    </folders>
    <levels>
        <level>
            <step>0</step>
            <actions>
                <action>CREATE_ITEM_FROM_IMAGE</action>
                <action>EXTRACT_FOLDER_NAME_AS_CATEGORY_CUSTOM_1</action>
            </actions>
        </level>
    </levels>
</template>