<?xml version="1.0" encoding="UTF-8"?>
<template xmlns:xsi="http://www.w3.org/2001/XMLSchema-instance" xsi:noNamespaceSchemaLocation="file:///Volumes/Frederick%20Harris%20II/FOX%20Data%20Manager/config/dataset_template.xsd">
	<rootFolder>		
		<path>/Volumes/Frederick Harris II/Dissertation Data/MyFoodRepo</path>	
		<name>MyFoodRepo</name>	
	</rootFolder>		
			<folders>
				<folder>
					<paths>
						<path>/Volumes/Frederick Harris II/Dissertation Data/MyFoodRepo/val-v0.4/val/images</path>
						<path>/Volumes/Frederick Harris II/Dissertation Data/MyFoodRepo/train-v0.4/train/images</path>
					</paths>
					<actions>
						<action>CREATE_FOOD_ITEM_FROM_IMAGE</action>
					</actions>
				</folder>
			</folders>
	<annotationFiles>
		<annotationFile>
			<paths>
				<path>/Volumes/Frederick Harris II/Dissertation Data/MyFoodRepo/val-v0.4/val/annotations.json</path>
				<path>/Volumes/Frederick Harris II/Dissertation Data/MyFoodRepo/train-v0.4/train/annotations.json</path>
			</paths>
				<priority>1</priority>
				<annotationType>DEFINES_ITEM_INSTANCES</annotationType>
				<actions>
					<action>MYFOODREPO_DATA_EXTRACT</action>
				</actions>
		</annotationFile>
	</annotationFiles>
</template>			