<?xml version="1.0" encoding="UTF-8"?>
<template xmlns:xsi="http://www.w3.org/2001/XMLSchema-instance"
	xsi:noNamespaceSchemaLocation="file:///Volumes/Frederick%20Harris%20II/FOX%20Data%20Manager/config/dataset_template.xsd">
	<rootFolder>
		<path>/Volumes/Frederick Harris II/Dissertation Data/Date_Fruit_Datasets</path>
		<name>Date_Fruit_Datasets</name>
	</rootFolder>
	<annotationFiles>
		<annotationFile>
			<paths>
				<path>/Volumes/Frederick Harris II/Dissertation Data/Date_Fruit_Datasets/Date_Fruit_Datasets.xlsx</path>
			</paths>
			<priority>1</priority>
			<annotationType>SPREADSHEET</annotationType>
			<actions>
				<action>DATE_FRUIT_DATASETS_PARSE</action>
			</actions>
		</annotationFile>
	</annotationFiles>
</template>			