<?xml version="1.0" encoding="UTF-8"?>
<template xmlns:xsi="http://www.w3.org/2001/XMLSchema-instance"
	xsi:noNamespaceSchemaLocation="file:///Volumes/Frederick%20Harris%20II/FOX%20Data%20Manager/config/dataset_template.xsd">
	<rootFolder>
		<path>/Volumes/Frederick Harris II/Dissertation Data/food-101</path>
		<name>food-101</name>
	</rootFolder>
	<folders>
		<folder>
			<paths>
				<path>/Volumes/Frederick Harris II/Dissertation Data/food-101/images</path>
			</paths>
			<applicabilities>
				<applicability>ALL_FOLDERS</applicability>
			</applicabilities>
			<actions>
				<action>CREATE_FOOD_ITEM_FROM_IMAGE</action>
			</actions>
			<levels>
				<level>
					<step>0</step>
					<actions>
						<action>EXTRACT_FOLDER_NAME_AS_CATEGORY</action>
					</actions>
				</level>
			</levels>
		</folder>
	</folders>
	<annotationFiles>
		<annotationFile>
			<paths>
				<path>/Volumes/Frederick Harris II/Dissertation Data/food-101/meta/test.txt</path>
				<path>/Volumes/Frederick Harris II/Dissertation Data/food-101/meta/train.txt</path>
			</paths>
			<priority>1</priority>
			<annotationType>DATA_SPLIT</annotationType>
			<actions>
				<action>FILENAME_CONTAINING_DATA_SPLIT_TO_CONTENTS_FILENAME</action>
			</actions>
		</annotationFile>
	</annotationFiles>
</template>			
