<?xml version="1.0" encoding="UTF-8"?>
<template xmlns:xsi="http://www.w3.org/2001/XMLSchema-instance"
	xsi:noNamespaceSchemaLocation="file:///Volumes/Frederick%20Harris%20II/FOX%20Data%20Manager/config/dataset_template.xsd">
	<rootFolder>
		<path>/Volumes/Frederick Harris II/Dissertation Data/Food-5K</path>
		<name>Food-5K</name>
	</rootFolder>
	<levels>
		<level>
			<step>0</step>
			<applicabilities>
				<applicability>ALL_FOLDERS</applicability>
			</applicabilities>
			<actions>
				<action>EXTRACT_FOLDER_NAME_AS_DATA_SPLIT</action>
			</actions>
		</level>
		<level>
			<step>1</step>
			<applicabilities>
				<applicability>ALL_FOLDERS</applicability>
			</applicabilities>
			<actions>
				<action>CREATE_ITEM_BASED_ON_FOOD_NON_FOOD</action>
			</actions>
		</level>
	</levels>
</template>			