<?xml version="1.0" encoding="UTF-8"?>
<template xmlns:xsi="http://www.w3.org/2001/XMLSchema-instance"
	xsi:noNamespaceSchemaLocation="file:///Volumes/Frederick%20Harris%20II/Templates/dataset_template.xsd">
	<rootFolder>
		<path>/Volumes/Frederick Harris II/Dissertation Data/Dry_Bean_Dataset</path>
		<name>Dry_Bean_Dataset</name>
	</rootFolder>
	<annotationFiles>
		<annotationFile>
			<paths>
				<path>/Volumes/Frederick Harris II/Dissertation Data/Dry_Bean_Dataset/Dry_Bean_Dataset.xlsx</path>
			</paths>
			<priority>1</priority>
			<annotationType>SPREADSHEET</annotationType>
			<actions>
				<action>DRY_BEAN_DATASET_PARSE</action>
			</actions>
		</annotationFile>
	</annotationFiles>
</template>			