<?xml version="1.0" encoding="UTF-8"?>
<template xmlns:xsi="http://www.w3.org/2001/XMLSchema-instance"
	xsi:noNamespaceSchemaLocation="file:///Volumes/Frederick%20Harris%20II/FOX%20Data%20Manager/config/dataset_template.xsd">
	<rootFolder>
		<path>/Volumes/Frederick Harris II/Dissertation Data/PFID</path>
		<name>PFID</name>
	</rootFolder>
	<folders>
		<folder>
			<paths>
				<path>/Volumes/Frederick Harris II/Dissertation Data/PFID/data</path>
				<path>/Volumes/Frederick Harris II/Dissertation Data/PFID/FPID_Restuarant_Stills</path>
			</paths>
			<actions>
				<action>CREATE_ITEM_FROM_IMAGE</action>
			</actions>
		</folder>
	</folders>
</template>			