<?xml version="1.0" encoding="UTF-8"?>
<template xmlns:xsi="http://www.w3.org/2001/XMLSchema-instance"
	xsi:noNamespaceSchemaLocation="file:///Volumes/Frederick%20Harris%20II/FOX%20Data%20Manager/config/dataset_template.xsd">
	<rootFolder>
		<path>/Volumes/Frederick Harris II/Dissertation Data/FoodLogoDet-1500</path>
		<name>FoodLogoDet-1500</name>
	</rootFolder>
	<folders>
		<folder>
			<paths>
				<path>/Volumes/Frederick Harris II/Dissertation Data/FoodLogoDet-1500/JPEGImages</path>
			</paths>
			<applicabilities>
				<applicability>ALL_FOLDERS</applicability>
			</applicabilities>
			<actions>
				<action>CREATE_ITEM_FROM_IMAGE</action>
			</actions>
		</folder>
	</folders>
	<annotationFiles>
		<annotationFile>
			<paths>
				<path>/Volumes/Frederick Harris II/Dissertation Data/FoodLogoDet-1500/ImageSets/Main/test.txt</path>
				<path>/Volumes/Frederick Harris II/Dissertation Data/FoodLogoDet-1500/ImageSets/Main/train.txt</path>
				<path>/Volumes/Frederick Harris II/Dissertation Data/FoodLogoDet-1500/ImageSets/Main/trainval.txt</path>
				<path>/Volumes/Frederick Harris II/Dissertation Data/FoodLogoDet-1500/ImageSets/Main/val.txt</path>
			</paths>
			<priority>1</priority>
			<annotationType>DATA_SPLIT</annotationType>
			<actions>
				<action>FILENAME_CONTAINING_DATA_SPLIT_TO_CONTENTS_FILENAME</action>
			</actions>
		</annotationFile>
		<annotationFile>
			<paths>
				<path>/Volumes/Frederick Harris II/Dissertation Data/FoodLogoDet-1500/Annotations</path>
			</paths>
			<priority>1</priority>
			<annotationType>DEFINES_ITEM_INSTANCES</annotationType>
			<actions>
				<action>FOODLOGODET1500_ANNOTATION_PARSE</action>
			</actions>
		</annotationFile>
	</annotationFiles>
</template>			