<?xml version="1.0" encoding="UTF-8"?>
<template xmlns:xsi="http://www.w3.org/2001/XMLSchema-instance"
	xsi:noNamespaceSchemaLocation="file:///Volumes/Frederick%20Harris%20II/Templates/dataset_template.xsd">
	<rootFolder>
		<path>/Volumes/Frederick Harris II/Dissertation Data/UNIMIB2016</path>
		<name>UNIMIB2016</name>
	</rootFolder>
	<folders>
		<folder>
			<paths>
				<path>/Volumes/Frederick Harris II/Dissertation Data/UNIMIB2016/original</path>
			</paths>
			<actions>
				<action>CREATE_FOOD_ITEM_FROM_IMAGE</action>
			</actions>
		</folder>
	</folders>
</template>			