<?xml version="1.0" encoding="UTF-8"?>
<template xmlns:xsi="http://www.w3.org/2001/XMLSchema-instance"
	xsi:noNamespaceSchemaLocation="file:///Volumes/Frederick%20Harris%20II/FOX%20Data%20Manager/config/dataset_template.xsd">
	<rootFolder>
		<path>/Volumes/Frederick Harris II/Dissertation Data/SEG-FOOD</path>
		<name>SEG-FOOD</name>
	</rootFolder>
	<folders>
		<folder>
			<paths>
				<path>/Volumes/Frederick Harris II/Dissertation Data/SEG-FOOD/trainingimages</path>
				<path>/Volumes/Frederick Harris II/Dissertation Data/SEG-FOOD/validationimages</path>
			</paths>
			<applicabilities>
				<applicability>ALL_FOLDERS</applicability>
			</applicabilities>
			<actions>
				<action>CREATE_FOOD_ITEM_FROM_IMAGE</action>
				<action>EXTRACT_FOLDER_NAME_CONTAINING_DATA_SPLIT</action>
			</actions>
		</folder>
		<folder>
			<paths>
				<path>/Volumes/Frederick Harris II/Dissertation Data/SEG-FOOD/traininglabels</path>
				<path>/Volumes/Frederick Harris II/Dissertation Data/SEG-FOOD/validationlabels</path>
			</paths>
			<applicabilities>
				<applicability>ALL_FOLDERS</applicability>
			</applicabilities>
			<actions>
				<action>MASK_MATCH_BY_NAME</action>
				<action>EXTRACT_FOLDER_NAME_CONTAINING_DATA_SPLIT</action>
			</actions>
		</folder>
	</folders>
</template>			