<?xml version="1.0" encoding="UTF-8"?>
<template xmlns:xsi="http://www.w3.org/2001/XMLSchema-instance"
	xsi:noNamespaceSchemaLocation="file:///Volumes/Frederick%20Harris%20II/FOX%20Data%20Manager/config/dataset_template.xsd">
	<rootFolder>
		<path>/Volumes/Frederick Harris II/Dissertation Data/Oktoberfest</path>
		<name>Oktoberfest</name>
	</rootFolder>
	<folders>
		<folder>
			<paths>
				<path>/Volumes/Frederick Harris II/Dissertation Data/Oktoberfest/dataset/test</path>
				<path>/Volumes/Frederick Harris II/Dissertation Data/Oktoberfest/dataset/train</path>
			</paths>
			<actions>
				<action>CREATE_ITEM_FROM_IMAGE</action>
				<action>EXTRACT_FOLDER_NAME_AS_DATA_SPLIT</action>
			</actions>
		</folder>
	</folders>
	<annotationFiles>
		<annotationFile>
			<paths>
				<path>/Volumes/Frederick Harris II/Dissertation Data/Oktoberfest/dataset/test/files.txt</path>
				<path>/Volumes/Frederick Harris II/Dissertation Data/Oktoberfest/dataset/train/files.txt</path>
			</paths>
			<priority>1</priority>
			<annotationType>DEFINES_ITEM_INSTANCES</annotationType>
			<actions>
				<action>OKTOBERFEST_ANNOTATION_EXTRACT</action>
			</actions>
		</annotationFile>
	</annotationFiles>
</template>			