<?xml version="1.0" encoding="UTF-8"?>
<template xmlns:xsi="http://www.w3.org/2001/XMLSchema-instance"
	xsi:noNamespaceSchemaLocation="file:///Volumes/Frederick%20Harris%20II/FOX%20Data%20Manager/config/dataset_template.xsd">
	<rootFolder>
		<path>/Volumes/Frederick Harris II/Dissertation Data/school_lunch</path>
		<name>school_lunch</name>
	</rootFolder>
	<folders>
		<folder>
			<paths>
				<path>/Volumes/Frederick Harris II/Dissertation Data/school_lunch/Images</path>
			</paths>
			<actions>
				<action>CREATE_FOOD_ITEM_FROM_IMAGE</action>
			</actions>
		</folder>
	</folders>
	<annotationFiles>
		<annotationFile>
			<paths>
				<path>/Volumes/Frederick Harris II/Dissertation Data/school_lunch/Annotations</path>
			</paths>
			<priority>1</priority>
			<annotationType>DEFINES_ITEM_INSTANCES</annotationType>
			<actions>
				<action>SCHOOL_LUNCH_DATA_EXTRACT</action>
			</actions>
		</annotationFile>
		<annotationFile>
			<paths>
				<path>/Volumes/Frederick Harris II/Dissertation Data/school_lunch/category.txt</path>
			</paths>
			<priority>2</priority>
			<annotationType>DEFINES_ITEM_INSTANCES</annotationType>
			<actions>
				<action>SCHOOL_LUNCH_LABEL_DEFINE</action>
			</actions>
		</annotationFile>
	</annotationFiles>
</template>			
