<?xml version="1.0" encoding="UTF-8"?>
<template xmlns:xsi="http://www.w3.org/2001/XMLSchema-instance"
	xsi:noNamespaceSchemaLocation="file:///Volumes/Frederick%20Harris%20II/FOX%20Data%20Manager/config/dataset_template.xsd">
	<rootFolder>
		<path>/Volumes/Frederick Harris II/Dissertation Data/OLAF adolescents</path>
		<name>OLAF adolescents</name>
	</rootFolder>
	<folders>
		<folder>
			<paths>
				<path>/Volumes/Frederick Harris II/Dissertation Data/OLAF adolescents/fat n6 order1</path>
				<path>/Volumes/Frederick Harris II/Dissertation Data/OLAF adolescents/fat n6 order2</path>
				<path>/Volumes/Frederick Harris II/Dissertation Data/OLAF adolescents/fat n6 order3</path>
				<path>/Volumes/Frederick Harris II/Dissertation Data/OLAF adolescents/fat n6 order4</path>
				<path>/Volumes/Frederick Harris II/Dissertation Data/OLAF adolescents/fruit n6 order1</path>
				<path>/Volumes/Frederick Harris II/Dissertation Data/OLAF adolescents/fruit n6 order2</path>
				<path>/Volumes/Frederick Harris II/Dissertation Data/OLAF adolescents/fruit n6 order3 </path>
				<path>/Volumes/Frederick Harris II/Dissertation Data/OLAF adolescents/fruit n6 order4</path>
				<path>/Volumes/Frederick Harris II/Dissertation Data/OLAF adolescents/sugar n6 order1</path>
				<path>/Volumes/Frederick Harris II/Dissertation Data/OLAF adolescents/sugar n6 order2</path>
				<path>/Volumes/Frederick Harris II/Dissertation Data/OLAF adolescents/sugar n6 order3 </path>
				<path>/Volumes/Frederick Harris II/Dissertation Data/OLAF adolescents/sugar n6 order4</path>
				<path>/Volumes/Frederick Harris II/Dissertation Data/OLAF adolescents/veggies n6 order1</path>
				<path>/Volumes/Frederick Harris II/Dissertation Data/OLAF adolescents/veggies n6 order2</path>
				<path>/Volumes/Frederick Harris II/Dissertation Data/OLAF adolescents/veggies n6 order3</path>
				<path>/Volumes/Frederick Harris II/Dissertation Data/OLAF adolescents/veggies n6 order4</path>
			</paths>
			<actions>
				<action>CREATE_FOOD_ITEM_FROM_IMAGE</action>
				<action>EXTRACT_FOLDER_NAME_AS_CATEGORY_CUSTOM_2</action>
			</actions>
		</folder>
	</folders>
</template>			