<?xml version="1.0" encoding="UTF-8"?>
<template xmlns:xsi="http://www.w3.org/2001/XMLSchema-instance"
	xsi:noNamespaceSchemaLocation="file:///Volumes/Frederick%20Harris%20II/FOX%20Data%20Manager/config/dataset_template.xsd">
	<rootFolder>
		<path>/Volumes/Frederick Harris II/Dissertation Data/FFoCat</path>
		<name>FFoCat</name>
	</rootFolder>
	<folders>
		<folder>
			<paths>
				<path>/Volumes/Frederick Harris II/Dissertation Data/FFoCat/valid</path>
				<path>/Volumes/Frederick Harris II/Dissertation Data/FFoCat/train</path>
			</paths>
			<actions>
				<action>EXTRACT_FOLDER_NAME_AS_DATA_SPLIT</action>
			</actions>
			<levels>
				<level>
					<step>0</step>
					<actions>
						<action>EXTRACT_FOLDER_NAME_AS_CATEGORY</action>
					</actions>
				</level>
				<level>
					<step>1</step>
					<actions>
						<action>CREATE_FOOD_ITEM_FROM_IMAGE</action>
						<action>EXTRACT_FILENAME_AS_NAME</action>
					</actions>
				</level>
			</levels>
		</folder>
	</folders>
	<annotationFiles>
		<annotationFile>
			<paths>
				<path>/Volumes/Frederick Harris II/Dissertation Data/FFoCat/food_food_category_map.tsv</path>
			</paths>
			<priority>1</priority>
			<actions>
				<action>FFOCAT_CATEGORY_INGREDIENT_PARSE</action>
			</actions>
		</annotationFile>
	</annotationFiles>
</template>