<?xml version="1.0" encoding="UTF-8"?>
<template xmlns:xsi="http://www.w3.org/2001/XMLSchema-instance"
	xsi:noNamespaceSchemaLocation="file:///Volumes/Frederick%20Harris%20II/FOX%20Data%20Manager/config/dataset_template.xsd">
	<rootFolder>
		<path>/Volumes/Frederick Harris II/Dissertation Data/KenyanFood13</path>
		<name>Kenyan104k</name>
	</rootFolder>

	<folders>
		<folder>
			<paths>
				<path>/Volumes/Frederick Harris II/Dissertation Data/KenyanFood13/test</path>
				<path>/Volumes/Frederick Harris II/Dissertation Data/KenyanFood13/train</path>
				<path>/Volumes/Frederick Harris II/Dissertation Data/KenyanFood13/val</path>
			</paths>
			<actions>
				<action>EXTRACT_FOLDER_NAME_AS_DATA_SPLIT</action>
				<action>CREATE_FOOD_ITEM_FROM_IMAGE</action>
			</actions>
			<levels>
				<level>
					<step>0</step>
					<actions>
						<action>EXTRACT_FOLDER_NAME_AS_CATEGORY</action>
					</actions>
				</level>
			</levels>
		</folder>
	</folders>
	<annotationFiles>
		<annotationFile>
			<paths>
				<path>/Volumes/Frederick Harris II/Dissertation Data/KenyanFood13/text.csv</path>
			</paths>
			<priority>1</priority>
			<annotationType>DEFINES_ITEM_INSTANCES</annotationType>
			<actions>
				<action>KENYANFOOD13_DATA_EXTRACT</action>
			</actions>
		</annotationFile>
	</annotationFiles>

</template>			