<?xml version="1.0" encoding="UTF-8"?>
<template xmlns:xsi="http://www.w3.org/2001/XMLSchema-instance"
	xsi:noNamespaceSchemaLocation="file:///Volumes/Frederick%20Harris%20II/Templates/dataset_template.xsd">
	<rootFolder>
		<path>/Volumes/Frederick Harris II/Dissertation Data/THFOOD50-v1</path>
		<name>THFOOD50-v1</name>
	</rootFolder>
	<folders>
		<folder>
			<paths>
				<path>/Volumes/Frederick Harris II/Dissertation Data/THFOOD50-v1/train</path>
				<path>/Volumes/Frederick Harris II/Dissertation Data/THFOOD50-v1/val</path>
			</paths>
			<actions>
				<action>CREATE_ITEM_FROM_IMAGE</action>
				<action>EXTRACT_FOLDER_NAME_CONTAINING_DATA_SPLIT</action>
			</actions>
			<levels>
				<level>
					<step>0</step>
					<actions>
						<action>EXTRACT_FOLDER_NAME_AS_CATEGORY</action>
					</actions>
				</level>
			</levels>
		</folder>
	</folders>
</template>			