<?xml version="1.0" encoding="UTF-8"?>
<template xmlns:xsi="http://www.w3.org/2001/XMLSchema-instance"
	xsi:noNamespaceSchemaLocation="file:///Volumes/Frederick%20Harris%20II/FOX%20Data%20Manager/config/dataset_template.xsd">
	<rootFolder>
		<path>/Volumes/Frederick Harris II/Dissertation Data/FoodPics_extended_2022</path>
		<name>FoodPics_extended_2022</name>
	</rootFolder>
	<folders>
		<folder>
			<paths>
				<path>/Volumes/Frederick Harris II/Dissertation Data/FoodPics_extended_2022</path>
			</paths>
			<applicabilities>
				<applicability>ALL_FOLDERS</applicability>
			</applicabilities>
			<actions>
				<action>CREATE_ITEM_FROM_IMAGE</action>
			</actions>
		</folder>
	</folders>
	<annotationFiles>
		<annotationFile>
			<paths>
				<path>/Volumes/Frederick Harris II/Dissertation Data/FoodPics_extended_2022/food.pics.extended.database (Stand 2022).xlsx</path>

			</paths>
			<priority>1</priority>
			<annotationType>DEFINES_ITEM_INSTANCES</annotationType>
			<actions>
				<action>FOODPICS_EXTENDED_ANNOTATION_PARSE</action>
			</actions>
		</annotationFile>
	</annotationFiles>
</template>			