<?xml version="1.0" encoding="UTF-8"?>
<template xmlns:xsi="http://www.w3.org/2001/XMLSchema-instance"
	xsi:noNamespaceSchemaLocation="file:///Volumes/Frederick%20Harris%20II/FOX%20Data%20Manager/config/dataset_template.xsd">
	<rootFolder>
		<path>/Volumes/Frederick Harris II/Dissertation Data/Recipes5k</path>
		<name>Recipes5k</name>
	</rootFolder>
	<folders>
		<folder>
			<paths>
				<path>/Volumes/Frederick Harris II/Dissertation Data/Recipes5k/images</path>
			</paths>
			<actions>

				<action>CREATE_ITEM_FROM_IMAGE</action>
			</actions>
			<levels>
				<level>
					<step>0</step>
					<actions>
						<action>EXTRACT_FOLDER_NAME_AS_CATEGORY</action>
					</actions>
				</level>
			</levels>
		</folder>
	</folders>
	<annotationFiles>
		<annotationFile>
			<paths>
				<path>/Volumes/Frederick Harris II/Dissertation Data/Recipes5k/annotations/train_images.txt</path>
				<path>/Volumes/Frederick Harris II/Dissertation Data/Recipes5k/annotations/test_images.txt</path>
				<path>/Volumes/Frederick Harris II/Dissertation Data/Recipes5k/annotations/val_images.txt</path>
			</paths>
			<priority>1</priority>
			<annotationType>DEFINES_ITEM_INSTANCES</annotationType>
			<actions>
				<action>FILENAME_CONTAINING_DATA_SPLIT_TO_CONTENTS_FILENAME</action>
			</actions>
		</annotationFile>
	</annotationFiles>
</template>			