<?xml version="1.0" encoding="UTF-8"?>
<template xmlns:xsi="http://www.w3.org/2001/XMLSchema-instance"
	xsi:noNamespaceSchemaLocation="file:///Volumes/Frederick%20Harris%20II/FOX%20Data%20Manager/config/dataset_template.xsd">
	<rootFolder>
		<path>/Volumes/Frederick Harris II/Dissertation Data/MAFood121</path>
		<name>MAFood121</name>
	</rootFolder>

	<folders>
		<folder>
			<paths>
				<path>/Volumes/Frederick Harris II/Dissertation Data/MAFood121/images</path>
			</paths>
			<actions>
				<action>CREATE_FOOD_ITEM_FROM_IMAGE</action>
			</actions>

			<levels>
				<level>
					<step>0</step>
					<actions>
						<action>EXTRACT_FOLDER_NAME_AS_CATEGORY</action>
					</actions>
				</level>
			</levels>
		</folder>
	</folders>
	<annotationFiles>
		<annotationFile>
			<paths>
				<path>/Volumes/Frederick Harris II/Dissertation Data/MAFood121/annotations/test.txt</path>
				<path>/Volumes/Frederick Harris II/Dissertation Data/MAFood121/annotations/train.txt</path>
				<path>/Volumes/Frederick Harris II/Dissertation Data/MAFood121/annotations/val.txt</path>
			</paths>
			<priority>1</priority>
			<annotationType>DEFINES_ITEM_INSTANCES</annotationType>
			<actions>
				<action>MAFOOD121_DATA_EXTRACT</action>
			</actions>
		</annotationFile>
	</annotationFiles>
</template>			