<?xml version="1.0" encoding="UTF-8"?>
<template xmlns:xsi="http://www.w3.org/2001/XMLSchema-instance"
	xsi:noNamespaceSchemaLocation="file:///Volumes/Frederick%20Harris%20II/FOX%20Data%20Manager/config/dataset_template.xsd">
	<rootFolder>
		<path>/Volumes/Frederick Harris II/Dissertation Data/Mango dataset1 - original</path>
		<name>Mango_dataset1</name>
	</rootFolder>
	<folders>
		<folder>
			<paths>
				<path>/Volumes/Frederick Harris II/Dissertation Data/Mango dataset1 - original/original-1</path>
			</paths>
			<actions>
				<action>CREATE_FOOD_ITEM_FROM_IMAGE</action>
			</actions>
		</folder>
		<folder>
			<paths>
				<path>/Volumes/Frederick Harris II/Dissertation Data/Mango dataset1 - original/original-1/label</path>
			</paths>
			<ignores>
				<ignore>ALL</ignore>
			</ignores>
			<actions>
				<action>NONE</action>
			</actions>
		</folder>
	</folders>
	<annotationFiles>
		<annotationFile>
			<paths>
				<path>/Volumes/Frederick Harris II/Dissertation Data/Mango dataset1 - original/original-1/label</path>
			</paths>
			<priority>1</priority>
			<annotationType>DEFINES_ITEM_INSTANCES</annotationType>
			<actions>
				<action>MANGO_DATASET_EXTRACT</action>
			</actions>
		</annotationFile>
	</annotationFiles>
</template>			